{"allocation":{"devices_per_group":6,"groups":4,"trials_per_device_sigma":20},"authentication":{"config_version":"puf-snn-auth-config-v2","handshake_timeout_ms":10000,"max_pending_sessions":128,"max_sessions_per_process":10000,"max_windows":10000,"protocol_profile":"puf-snn-l3-credential-admission-v1-wire2","session_ttl_ms":300000,"warmup_iterations":0},"bootstrap_resamples":10000,"bootstrap_seed":2026102803,"conditions":[{"common_offset":0,"name":"s010","rho":0,"sigma":0.1},{"common_offset":0,"name":"s015","rho":0,"sigma":0.15},{"common_offset":0,"name":"s020","rho":0,"sigma":0.2},{"common_offset":0,"name":"s025","rho":0,"sigma":0.25}],"confidence_level":0.95,"consumer_id":"recording-consumer-v1","decisions_status":"proposed-pending-review","enrollment_noise_std":0.0,"experiment_id":"week9-shared-noise-calibration-v1","final_execution_enabled":false,"group_sensitivity_seed":2026102804,"interval_scope":"pointwise-estimation-only","manufacturing_std":1.0,"master_seed":2026102801,"mode":"bounded-calibration","policies":["single-read-v1","majority-3-v1"],"resource_budgets":{"bundle_growth_bytes":536870912,"bundle_seconds":1800.0,"memory_bytes":4294967296,"min_free_disk_bytes":1073741824,"min_free_ram_bytes":8589934592,"sample_seconds":0.05,"session_seconds":1800.0,"stop_grace_seconds":2.0,"total_growth_bytes":1073741824},"retries":0,"rules_version":"week9-shared-noise-calibration-v1:proposed-rules-v1","schedule_seed":2026102802,"schema_version":"week9-shared-noise-calibration-v1:config","selection_rules":{"delta_ci_width_max":0.2,"delta_min":0.02,"discordances_min":20,"event_devices_min":6,"event_groups_min":3,"group_delta_min":-0.02,"leave_device_delta_min":0.01,"majority_frr_max":0.5,"positive_groups_min":3,"single_ci_lower_min":0.01,"single_ci_upper_max":0.85,"single_correct_min":24,"single_failures_min":24,"single_frr_max":0.7,"single_frr_min":0.05},"specification_path":"docs/week9-shared-noise-study-specification.md","timing_profile":"cold-process-no-harness-warmup-v1","window_id":"week7-fixed-window-v1"}
